{
  "$schema": "https://json-schema.org/draft/2020-12/schema",
  "$id": "https://preppy.local/schema/paper-v1.json",
  "title": "Preppy paper",
  "description": "The JSON format for a Preppy paper. A paper is checked against the pattern of the exam it is uploaded for: which sections it has, in what order, and how many questions each holds all come from that pattern unless the file says otherwise. This schema cannot know which exam you mean, so it accepts any of the six section codes in any order; the app is stricter.",
  "type": "object",
  "required": [
    "format",
    "version",
    "date",
    "sections"
  ],
  "additionalProperties": false,
  "properties": {
    "format": {
      "const": "preppy-paper"
    },
    "version": {
      "const": 1
    },
    "date": {
      "type": "string",
      "pattern": "^\\d{4}-\\d{2}-\\d{2}$",
      "description": "The day this paper opens, YYYY-MM-DD. Its window is chosen when it is scheduled, not here: a day and a time for each end, and entry may close on the following morning. A paper that opens on the 28th and takes entry until 1 AM on the 29th is still the 28th's paper everywhere it is counted."
    },
    "title": {
      "type": "string",
      "minLength": 1,
      "maxLength": 80,
      "description": "What students and the archive call this paper, and part of what identifies it: a paper is its exam, its date and its name, so two papers on one night must differ by name. Optional, and then the paper is known by its date -- but only one untitled paper can be scheduled per day per exam. The upload screen offers a name box that overrides whatever is here, so a file that names itself badly can be fixed without editing it, and a paper can be renamed afterwards from Manage."
    },
    "sections": {
      "type": "array",
      "minItems": 1,
      "maxItems": 6,
      "description": "The sections of the exam this paper is for, in the order they are sat. Four on the pattern the product ships with (QUANT, REASONING, ENGLISH, PK); a track decides its own, so an editor cannot check the order and the app does.",
      "items": {
        "$ref": "#/$defs/section"
      }
    }
  },
  "$defs": {
    "optionLabel": {
      "enum": [
        "A",
        "B",
        "C",
        "D"
      ]
    },
    "section": {
      "type": "object",
      "required": [
        "code",
        "questions"
      ],
      "additionalProperties": false,
      "properties": {
        "code": {
          "enum": [
            "QUANT",
            "REASONING",
            "ENGLISH",
            "PK",
            "COMPUTER_AWARENESS",
            "GENERAL_AWARENESS"
          ]
        },
        "questionCount": {
          "type": "integer",
          "minimum": 1,
          "maximum": 200,
          "description": "How many questions this section holds, when that differs from the default pattern. Omit to use the pattern. If given, it must equal the length of \"questions\"."
        },
        "durationMinutes": {
          "type": "number",
          "minimum": 1,
          "maximum": 180
        },
        "marksCorrect": {
          "type": "number",
          "minimum": 0.01,
          "maximum": 10
        },
        "marksNegative": {
          "type": "number",
          "minimum": 0,
          "maximum": 10
        },
        "directions": {
          "type": "array",
          "items": {
            "$ref": "#/$defs/directions"
          }
        },
        "questions": {
          "type": "array",
          "items": {
            "$ref": "#/$defs/question"
          }
        }
      }
    },
    "directions": {
      "type": "object",
      "required": [
        "from",
        "to",
        "text"
      ],
      "additionalProperties": false,
      "description": "Shared material: a reading passage, a data table, or a puzzle. Applies to questions from..to inclusive.",
      "properties": {
        "from": {
          "type": "integer",
          "minimum": 1,
          "maximum": 800,
          "description": "First question this material covers."
        },
        "to": {
          "type": "integer",
          "minimum": 1,
          "maximum": 800,
          "description": "Last question this material covers, inclusive."
        },
        "text": {
          "type": "string",
          "pattern": "\\S",
          "description": "Must contain something other than spaces."
        },
        "table": {
          "$ref": "#/$defs/table"
        },
        "images": {
          "type": "array",
          "items": {
            "type": "string",
            "pattern": "^[A-Za-z0-9][A-Za-z0-9._-]{0,99}\\.([Pp][Nn][Gg]|[Jj][Pp][Ee]?[Gg]|[Ww][Ee][Bb][Pp]|[Gg][Ii][Ff])$"
          }
        }
      }
    },
    "table": {
      "type": "object",
      "required": [
        "headers",
        "rows"
      ],
      "additionalProperties": false,
      "description": "Structured table data. Never rely on aligned spaces inside text; the browser collapses them.",
      "properties": {
        "headers": {
          "type": "array",
          "minItems": 1,
          "items": {
            "type": "string"
          }
        },
        "rows": {
          "type": "array",
          "items": {
            "type": "array",
            "items": {
              "type": "string"
            }
          }
        }
      }
    },
    "question": {
      "type": "object",
      "required": [
        "number",
        "text",
        "options",
        "answer"
      ],
      "additionalProperties": false,
      "properties": {
        "number": {
          "type": "integer",
          "minimum": 1,
          "maximum": 800,
          "description": "Position within the paper: unique per section, continuous across the paper, and inside the band its section owns. The ceiling is four sections at the Paper pattern screen's own maximum of 200 a section, not the count of any one exam pattern."
        },
        "text": {
          "type": "string",
          "pattern": "^\\s*\\S[\\s\\S]{8,}\\S\\s*$",
          "description": "At least 10 characters, not counting spaces at either end."
        },
        "options": {
          "type": "object",
          "minProperties": 4,
          "maxProperties": 4,
          "additionalProperties": false,
          "propertyNames": {
            "$ref": "#/$defs/optionLabel"
          },
          "patternProperties": {
            "^[A-D]$": {
              "type": "string",
              "pattern": "\\S"
            }
          }
        },
        "answer": {
          "$ref": "#/$defs/optionLabel"
        },
        "solution": {
          "type": "string"
        },
        "tag": {
          "type": "string"
        },
        "difficulty": {
          "enum": [
            "Easy",
            "Medium",
            "Hard"
          ],
          "description": "Leave it out rather than empty."
        },
        "images": {
          "type": "array",
          "items": {
            "type": "string",
            "pattern": "^[A-Za-z0-9][A-Za-z0-9._-]{0,99}\\.([Pp][Nn][Gg]|[Jj][Pp][Ee]?[Gg]|[Ww][Ee][Bb][Pp]|[Gg][Ii][Ff])$"
          }
        }
      }
    }
  }
}
