{
  "format": "preppy-paper",
  "version": 1,
  "date": "9999-12-31",
  "title": "Daily Mock NNN",
  "sections": [
    {
      "code": "QUANT",
      "questionCount": 15,
      "durationMinutes": 12,
      "marksCorrect": 1,
      "marksNegative": 0.25,
      "directions": [
        {
          "from": 6,
          "to": 10,
          "text": "Optional. Use a directions block for anything several questions share: a reading passage, a data table, or a puzzle. Delete this block if the section does not need one.",
          "table": {
            "headers": [
              "Year",
              "Column A",
              "Column B"
            ],
            "rows": [
              [
                "2024",
                "12",
                "18"
              ],
              [
                "2025",
                "15",
                "24"
              ]
            ]
          }
        }
      ],
      "questions": [
        {
          "number": 1,
          "text": "Replace this with the text of question 1.",
          "options": {
            "A": "Replace with option A",
            "B": "Replace with option B",
            "C": "Replace with option C",
            "D": "Replace with option D"
          },
          "answer": "A",
          "solution": "Replace with the worked explanation. Optional but recommended.",
          "tag": "Topic-Name",
          "difficulty": "Easy"
        },
        {
          "number": 2,
          "text": "Replace this with the text of question 2.",
          "options": {
            "A": "Replace with option A",
            "B": "Replace with option B",
            "C": "Replace with option C",
            "D": "Replace with option D"
          },
          "answer": "A",
          "solution": "Replace with the worked explanation. Optional but recommended.",
          "tag": "Topic-Name",
          "difficulty": "Easy"
        },
        {
          "number": 3,
          "text": "Replace this with the text of question 3.",
          "options": {
            "A": "Replace with option A",
            "B": "Replace with option B",
            "C": "Replace with option C",
            "D": "Replace with option D"
          },
          "answer": "A",
          "solution": "Replace with the worked explanation. Optional but recommended.",
          "tag": "Topic-Name",
          "difficulty": "Easy"
        },
        {
          "number": 4,
          "text": "Replace this with the text of question 4.",
          "options": {
            "A": "Replace with option A",
            "B": "Replace with option B",
            "C": "Replace with option C",
            "D": "Replace with option D"
          },
          "answer": "A",
          "solution": "Replace with the worked explanation. Optional but recommended.",
          "tag": "Topic-Name",
          "difficulty": "Easy"
        },
        {
          "number": 5,
          "text": "Replace this with the text of question 5.",
          "options": {
            "A": "Replace with option A",
            "B": "Replace with option B",
            "C": "Replace with option C",
            "D": "Replace with option D"
          },
          "answer": "A",
          "solution": "Replace with the worked explanation. Optional but recommended.",
          "tag": "Topic-Name",
          "difficulty": "Easy"
        },
        {
          "number": 6,
          "text": "Replace this with the text of question 6.",
          "options": {
            "A": "Replace with option A",
            "B": "Replace with option B",
            "C": "Replace with option C",
            "D": "Replace with option D"
          },
          "answer": "A",
          "solution": "Replace with the worked explanation. Optional but recommended.",
          "tag": "Topic-Name",
          "difficulty": "Easy"
        },
        {
          "number": 7,
          "text": "Replace this with the text of question 7.",
          "options": {
            "A": "Replace with option A",
            "B": "Replace with option B",
            "C": "Replace with option C",
            "D": "Replace with option D"
          },
          "answer": "A",
          "solution": "Replace with the worked explanation. Optional but recommended.",
          "tag": "Topic-Name",
          "difficulty": "Easy"
        },
        {
          "number": 8,
          "text": "Replace this with the text of question 8.",
          "options": {
            "A": "Replace with option A",
            "B": "Replace with option B",
            "C": "Replace with option C",
            "D": "Replace with option D"
          },
          "answer": "A",
          "solution": "Replace with the worked explanation. Optional but recommended.",
          "tag": "Topic-Name",
          "difficulty": "Easy"
        },
        {
          "number": 9,
          "text": "Replace this with the text of question 9.",
          "options": {
            "A": "Replace with option A",
            "B": "Replace with option B",
            "C": "Replace with option C",
            "D": "Replace with option D"
          },
          "answer": "A",
          "solution": "Replace with the worked explanation. Optional but recommended.",
          "tag": "Topic-Name",
          "difficulty": "Easy"
        },
        {
          "number": 10,
          "text": "Replace this with the text of question 10.",
          "options": {
            "A": "Replace with option A",
            "B": "Replace with option B",
            "C": "Replace with option C",
            "D": "Replace with option D"
          },
          "answer": "A",
          "solution": "Replace with the worked explanation. Optional but recommended.",
          "tag": "Topic-Name",
          "difficulty": "Easy"
        },
        {
          "number": 11,
          "text": "Replace this with the text of question 11.",
          "options": {
            "A": "Replace with option A",
            "B": "Replace with option B",
            "C": "Replace with option C",
            "D": "Replace with option D"
          },
          "answer": "A",
          "solution": "Replace with the worked explanation. Optional but recommended.",
          "tag": "Topic-Name",
          "difficulty": "Easy"
        },
        {
          "number": 12,
          "text": "Replace this with the text of question 12.",
          "options": {
            "A": "Replace with option A",
            "B": "Replace with option B",
            "C": "Replace with option C",
            "D": "Replace with option D"
          },
          "answer": "A",
          "solution": "Replace with the worked explanation. Optional but recommended.",
          "tag": "Topic-Name",
          "difficulty": "Easy"
        },
        {
          "number": 13,
          "text": "Replace this with the text of question 13.",
          "options": {
            "A": "Replace with option A",
            "B": "Replace with option B",
            "C": "Replace with option C",
            "D": "Replace with option D"
          },
          "answer": "A",
          "solution": "Replace with the worked explanation. Optional but recommended.",
          "tag": "Topic-Name",
          "difficulty": "Easy"
        },
        {
          "number": 14,
          "text": "Replace this with the text of question 14.",
          "options": {
            "A": "Replace with option A",
            "B": "Replace with option B",
            "C": "Replace with option C",
            "D": "Replace with option D"
          },
          "answer": "A",
          "solution": "Replace with the worked explanation. Optional but recommended.",
          "tag": "Topic-Name",
          "difficulty": "Easy"
        },
        {
          "number": 15,
          "text": "Replace this with the text of question 15.",
          "options": {
            "A": "Replace with option A",
            "B": "Replace with option B",
            "C": "Replace with option C",
            "D": "Replace with option D"
          },
          "answer": "A",
          "solution": "Replace with the worked explanation. Optional but recommended.",
          "tag": "Topic-Name",
          "difficulty": "Easy"
        }
      ]
    },
    {
      "code": "REASONING",
      "questionCount": 15,
      "durationMinutes": 12,
      "marksCorrect": 1,
      "marksNegative": 0.25,
      "questions": [
        {
          "number": 16,
          "text": "Replace this with the text of question 16.",
          "options": {
            "A": "Replace with option A",
            "B": "Replace with option B",
            "C": "Replace with option C",
            "D": "Replace with option D"
          },
          "answer": "A",
          "solution": "Replace with the worked explanation. Optional but recommended.",
          "tag": "Topic-Name",
          "difficulty": "Easy"
        },
        {
          "number": 17,
          "text": "Replace this with the text of question 17.",
          "options": {
            "A": "Replace with option A",
            "B": "Replace with option B",
            "C": "Replace with option C",
            "D": "Replace with option D"
          },
          "answer": "A",
          "solution": "Replace with the worked explanation. Optional but recommended.",
          "tag": "Topic-Name",
          "difficulty": "Easy"
        },
        {
          "number": 18,
          "text": "Replace this with the text of question 18.",
          "options": {
            "A": "Replace with option A",
            "B": "Replace with option B",
            "C": "Replace with option C",
            "D": "Replace with option D"
          },
          "answer": "A",
          "solution": "Replace with the worked explanation. Optional but recommended.",
          "tag": "Topic-Name",
          "difficulty": "Easy"
        },
        {
          "number": 19,
          "text": "Replace this with the text of question 19.",
          "options": {